"post_id","timestamp","username","comment","comment_full","extra_lines_count"
"DZtLsxLPNcR","2026-06-18","linkaynic","So excited!!! Downloading now!","So excited!!! Downloading now! | 3wReply","1"
"DZtLsxLPNcR","2026-06-22","b0s46_","Its awesome but, id make it easier for me if there was an option for like an audible reading.","Its awesome but, id make it easier for me if there was an option for like an audible reading. | 3wReply | katie_clark89 | We can’t seem to find it? | 10hReply","4"
"DZtLsxLPNcR","2026-07-13","katie_clark89","We can’t seem to find it?","We can’t seem to find it? | 10hReply","1"
"DZtLsxLPNcR","2026-06-18","celovemore27","I've been waiting and checking every day! This is such a blessing in my life! Do you take suggestions? Because I think it would be really cool to be able to make friends or groups on the app so that my friends and I can encourage each other in our studies. It could also be useful for comp studies for missionaries, or to create partner or group study challenges!","I've been waiting and checking every day! This is such a blessing in my life! Do you take suggestions? Because I think it would be really cool to be able to make friends or groups on the app so that my friends and I can encourage each other in our studies. It could also be useful for comp studies for missionaries, or to create partner or group study challenges! | 3w7 likesReply","1"
"DZtLsxLPNcR","2026-06-22","kmkohlhepp83","I just downloaded it and started it. I'm already loving it. I know I'll be more addicted to this than Duolingo.","I just downloaded it and started it. I'm already loving it. I know I'll be more addicted to this than Duolingo. | 3w1 likeReply","1"
"DZtLsxLPNcR","2026-06-18","brynleerpeck","YAY","YAY | 3w1 likeReply","1"
"DZtLsxLPNcR","2026-06-18","2fly.ryguy","Amazing app, seriously but you should add some way to save your progress in the cloud, whether that be through icloud backup or like actual accounts through the app","Amazing app, seriously but you should add some way to save your progress in the cloud, whether that be through icloud backup or like actual accounts through the app | 3w2 likesReply","1"
"DZtLsxLPNcR","2026-06-21","2fly.ryguy","@evan.builds.tether Awesome great app dude","@evan.builds.tether Awesome great app dude | 3wReply","1"
"DZtLsxLPNcR","2026-06-18","k.row1","Just downloaded it!!","Just downloaded it!! | 3w1 likeReply","1"
"DZtLsxLPNcR","2026-06-19","beaubrewer2029","Next update you should add friends and the ability to share verses","Next update you should add friends and the ability to share verses | 3w5 likesReply","1"
"DZtLsxLPNcR","2026-06-21","beaubrewer2029","This is going to be one of your best updates!!!","This is going to be one of your best updates!!! | 3wReply","1"
"DZtLsxLPNcR","2026-06-18","post_brandon96","Bro this is actually SICK, thank you!","Bro this is actually SICK, thank you! | 3w2 likesReply","1"
"DZtLsxLPNcR","2026-06-18","nolan.courage7","One thing I suggest is you should be able to let the XP do something like give you rewards or something. Use the XP as like coins or whatever so that way you're not just building up XP but you can actually use it to spend on something","One thing I suggest is you should be able to let the XP do something like give you rewards or something. Use the XP as like coins or whatever so that way you're not just building up XP but you can actually use it to spend on something | 3w3 likesReply","1"
"DZtLsxLPNcR","2026-06-18","martins_matheus06","Thats ok. Now you only need put in Portuguese","Thats ok. Now you only need put in Portuguese | 3w2 likesReply","1"
"DZtLsxLPNcR","2026-06-19","thalamuseveryday","Do u know what a cult is? Bc u r in one. Get out and get free, it takes time but possible and needed and worth it!!","Do u know what a cult is? Bc u r in one. Get out and get free, it takes time but possible and needed and worth it!! | 3wReply","1"
"DZtLsxLPNcR","2026-06-22","kmkohlhepp83","@thalamuseveryday did you know that youre in a cult of HATE? thats all you antis do. You do not follow Jesus at all. You follow Satan. Satan preaches to hate others which is exactly what you do. Whats sad is your so called preachers preach that hate and the valiant little soldier you are, you follow that with your hate. Get a life and find Jeuss Christ.","@thalamuseveryday did you know that youre in a cult of HATE? thats all you antis do. You do not follow Jesus at all. You follow Satan. Satan preaches to hate others which is exactly what you do. Whats sad is your so called preachers preach that hate and the valiant little soldier you are, you follow that with your hate. Get a life and find Jeuss Christ. | 3w1 likeReply | evan.builds.tether | @thalamuseveryday 😂 | 1dReply","4"
"DZtLsxLPNcR","2026-06-18","mrnoahmelvin","Yeah cause it's a straight buns book of heresy","Yeah cause it's a straight buns book of heresy | 3wReply","1"
"DZtLsxLPNcR","2026-06-19","finnmiller64","@mrnoahmelvin go read it first bud and hop off reddit","@mrnoahmelvin go read it first bud and hop off reddit | 3w1 likeReply | mrnoahmelvin | Yeah it was so buns I couldn't even finish it | 3wReply","4"
"DZtLsxLPNcR","2026-06-19","mrnoahmelvin","Yeah it was so buns I couldn't even finish it","Yeah it was so buns I couldn't even finish it | 3wReply","1"
"DZtLsxLPNcR","2026-07-13","bradleydewit67","Dude i got so excited when I heard this","Dude i got so excited when I heard this | 22hReply","1"
"DZtLsxLPNcR","2026-07-09","builtuponyahweh","Bro, you stopped pushing it... I love the app and would love to see more people using it.","Bro, you stopped pushing it... I love the app and would love to see more people using it. | 4dReply","1"
"DZtLsxLPNcR","2026-07-07","calledtoshare","What program are you using to build the app?","What program are you using to build the app? | 6dReply","1"
"DZtLsxLPNcR","2026-07-07","solac_efavour","Can I share it","Can I share it | 6dReply","1"
"DZtLsxLPNcR","2026-07-07","solac_efavour","Where can I get it","Where can I get it | 6dReply","1"
"DZtLsxLPNcR","2026-07-03","isaacboyhill","Could you make one for the other books of scripture","Could you make one for the other books of scripture | 1wReply","1"
"DZtLsxLPNcR","2026-07-03","cassie_spamz619","I have a suggestion if you can find a way to get other languages in that would be amazing for people trying to learn their language and read the book of mormon in their missions language! I know it would probably be difficult to find people but I know it would be so helpful!","I have a suggestion if you can find a way to get other languages in that would be amazing for people trying to learn their language and read the book of mormon in their missions language! I know it would probably be difficult to find people but I know it would be so helpful! | 1wReply","1"
"DZtLsxLPNcR","2026-07-01","becky6d","Love the app. Would like to see XP or some kind of ranking like Duolingo has","Love the app. Would like to see XP or some kind of ranking like Duolingo has | 1wReply","1"
"DZtLsxLPNcR","2026-06-29","megan.gray85","Make a iOS one","Make a iOS one | 2wReply","1"
"DZtLsxLPNcR","2026-06-23","amaceying22","Just download it! Thank you for making this and making it available on android! I'll be telling people about it!","Just download it! Thank you for making this and making it available on android! I'll be telling people about it! | 2wReply","1"
"DZtLsxLPNcR","2026-06-23","haileyromesser","I love the app already!! Are you planning to add the books of the Bible and the doctrine & covenants?","I love the app already!! Are you planning to add the books of the Bible and the doctrine & covenants? | 2wReply","1"
"DZtLsxLPNcR","2026-06-22","mrs.spencer23","Yay yay yay!! It's so freaking cool 🔥 you need to make a share app button RIGHT now!!!","Yay yay yay!! It's so freaking cool 🔥 you need to make a share app button RIGHT now!!! | 3wReply","1"
"DZtLsxLPNcR","2026-06-18","elle.sophie.is.me","Got it and I'm so excited to start and to get my kids to start!!! Yay Evan! 👏👏","Got it and I'm so excited to start and to get my kids to start!!! Yay Evan! 👏👏 | 3wReply","1"
"DZtLsxLPNcR","2026-06-18","rayyj3nse","I got the app but when I click on the read button nothing happens!","I got the app but when I click on the read button nothing happens! | 3wReply","1"
"DZtLsxLPNcR","2026-06-18","phoenixtuiaana","Ok so this is awesome","Ok so this is awesome | 3wReply","1"
"DZtLsxLPNcR","2026-06-18","taylor_mae_at","This is so awesome!!","This is so awesome!! | 3wReply","1"
"DZtLsxLPNcR","2026-06-18","builtuponyahweh","Just downloaded it. Looks sick","Just downloaded it. Looks sick | 3wReply","1"
"DZtLsxLPNcR","2026-06-18","kaique_menegon","YEEEEESSS 🙌🔥","YEEEEESSS 🙌🔥 | 3wReply","1"
"DZtLsxLPNcR","2026-06-18","jamie_dejong","We can't find it on the app.","We can't find it on the app. | 3wReply","1"
"DZtLsxLPNcR","2026-06-18","wespeacher","Let's go!!!","Let's go!!! | 3wReply","1"
"DZtLsxLPNcR","2026-06-18","elle_lds_ojh","I love it!!","I love it!! | 3wReply","1"
"DZtLsxLPNcR","2026-06-17","jaxononimacaroni","Whoooo","Whoooo | 3wReply","1"