"post_id","timestamp","username","comment","comment_full","extra_lines_count"
"DYgEBAIyQow","2026-05-20","philipcalero","Do it for android phones","Do it for android phones | 3wReply","1"
"DYgEBAIyQow","2026-05-19","turnerethen8","i just need it on the google play store","i just need it on the google play store | 3w29 likesReply","1"
"DYgEBAIyQow","2026-05-22","cyberwarior32","can you let me beta test on playstore it says I can't message you","can you let me beta test on playstore it says I can't message you | 3wReply","1"
"DYgEBAIyQow","2026-05-19","bladenhowland","Available for android?","Available for android? | 3w16 likesReply","1"
"DYgEBAIyQow","2026-05-20","kathryngornichec","Love love love! Keep up the great work and keep building out those chapters! Maybe you could add questions or quiz on overall doctrine from each book. Also it would be fun to have a place to put personal notes or inspiration as you build and learn across the BOM","Love love love! Keep up the great work and keep building out those chapters! Maybe you could add questions or quiz on overall doctrine from each book. Also it would be fun to have a place to put personal notes or inspiration as you build and learn across the BOM | 3w2 likesReply","1"
"DYgEBAIyQow","2026-05-19","lydia.prestwich","I cant wait to try it! This is an amazing idea for missionaries!!!","I cant wait to try it! This is an amazing idea for missionaries!!! | 3w3 likesReply","1"
"DYgEBAIyQow","2026-05-20","north.bk","This sounds so hype!!!! I'm also on Android, so looking forward to when that comes out 😉 keep it up man!","This sounds so hype!!!! I'm also on Android, so looking forward to when that comes out 😉 keep it up man! | 3w1 likeReply","1"
"DYgEBAIyQow","2026-05-20","madihillrasmussen","BRILLIANT.","BRILLIANT. | 3wReply","1"
"DYgEBAIyQow","2026-05-24","lola_clairesmith","I know a lot of people have suggestions, but when you can, can you make it where you can highlight the verses? It helps me, and im sure it helps others relate and find things in the scriptures that can connect us to God more because we are searching for them","I know a lot of people have suggestions, but when you can, can you make it where you can highlight the verses? It helps me, and im sure it helps others relate and find things in the scriptures that can connect us to God more because we are searching for them | 3w1 likeReply","1"
"DYgEBAIyQow","2026-05-21","kayden_bird","An amazing nap I love it. You should make an audio as well. That will be so much better. I have a hard time reading that would be amazing","An amazing nap I love it. You should make an audio as well. That will be so much better. I have a hard time reading that would be amazing | 3w1 likeReply","1"
"DYgEBAIyQow","2026-05-28","aliya.gym","Hey I just used the app today! It was great! I think what would also be great in the future would be adding an option for a widget that you can put on your home screen similar to Duolingo, but also eventually adding the bible and doctrine and covenants as well as the pearl of great price. I think that would be wonderful. It is a wonderful app and a fantastic idea! Keep up the great work!!","Hey I just used the app today! It was great! I think what would also be great in the future would be adding an option for a widget that you can put on your home screen similar to Duolingo, but also eventually adding the bible and doctrine and covenants as well as the pearl of great price. I think that would be wonderful. It is a wonderful app and a fantastic idea! Keep up the great work!! | 2wReply","1"
"DYgEBAIyQow","2026-05-19","gavin_ferguson206","Just got it it’s so nice","Just got it it’s so nice | 3w2 likesReply","1"
"DYgEBAIyQow","2026-05-19","kayla.allred101","I love it! Please put more chapters! It would be great if we could get it in different languages too and also maybe side by side with English! I’m trying to learn the verses in Spanish! This is awesome!","I love it! Please put more chapters! It would be great if we could get it in different languages too and also maybe side by side with English! I’m trying to learn the verses in Spanish! This is awesome! | 3w10 likesReply","1"
"DYgEBAIyQow","2026-05-21","houston.dad19","This is awesome!! Got through my first day and this is dope! Don’t stop getting more chapters and fun out there.","This is awesome!! Got through my first day and this is dope! Don’t stop getting more chapters and fun out there. | 3w1 likeReply","1"
"DYgEBAIyQow","2026-05-21","sydneyw6708","On Duolingo there’s different things you can learn (different languages, math, music, chess) so I think being able to have the choice to read all the different books not just the BOM. Would be a great addition to the app!","On Duolingo there’s different things you can learn (different languages, math, music, chess) so I think being able to have the choice to read all the different books not just the BOM. Would be a great addition to the app! | 3w1 likeReply","1"
"DYgEBAIyQow","2026-05-23","brinley_provost","Just waiting for more chapters! It works great!","Just waiting for more chapters! It works great! | 3wReply","1"
"DYgEBAIyQow","2026-06-02","dallindela","I did bro","I did bro | 1wReply","1"
"DYgEBAIyQow","2026-05-22","thetinylightpost","Waiting until it’s available in Germany 😍 even if it’s in English!","Waiting until it’s available in Germany 😍 even if it’s in English! | 3wReply","1"
"DYgEBAIyQow","2026-05-20","itsleilajade","CHECK YOUR DMS I HAVE SOMETHING!!!! ❤️","CHECK YOUR DMS I HAVE SOMETHING!!!! ❤️ | 3wReply","1"
"DYgEBAIyQow","2026-05-19","tatertot_hertz","Love it! I’m sure you already had this planned, but it’d be great if the comprehension questions also focused on core doctrines and principles of the gospel when they come up in the verses, rather than just facts of the situation. It keeps the focus on the purpose and message, not only the events that occur. It would be cool if those parts were highlighted after the answer is revealed, referencing the parts of the verse which provided the answer. Keep up the great work! This is legendary🔥","Love it! I’m sure you already had this planned, but it’d be great if the comprehension questions also focused on core doctrines and principles of the gospel when they come up in the verses, rather than just facts of the situation. It keeps the focus on the purpose and message, not only the events that occur. It would be cool if those parts were highlighted after the answer is revealed, referencing the parts of the verse which provided the answer. Keep up the great work! This is legendary🔥 | 3w6 likesReply","1"
"DYgEBAIyQow","2026-05-24","rajperson121","Yesss!!! It’s amazing I go through 2 little lessons a day and it’s amazing, if there was a way to go back to one section out of the lesson without having to go through the whole lesson would be killer!","Yesss!!! It’s amazing I go through 2 little lessons a day and it’s amazing, if there was a way to go back to one section out of the lesson without having to go through the whole lesson would be killer! | 3wReply","1"
"DYgEBAIyQow","2026-05-19","jovielizabeth.07","just waiting till it's Available for Android! :)","just waiting till it's Available for Android! :) | 3w61 likesReply","1"
"DYgEBAIyQow","2026-05-19","emoana2006","Android please! (I'll be a tester if needed)","Android please! (I'll be a tester if needed) | 3w5 likesReply","1"
"DYgEBAIyQow","2026-05-20","jarednielson_","Love this app! A widgets would be cool so you can remember your streak","Love this app! A widgets would be cool so you can remember your streak | 3w1 likeReply","1"
"DYgEBAIyQow","2026-05-21","spjutaustin","I got a suggestion for your app. You should make it so it can turn into a widget so it is always on my home screen. Just a suggestion, and I love the app by the way great idea ￼￼","I got a suggestion for your app. You should make it so it can turn into a widget so it is always on my home screen. Just a suggestion, and I love the app by the way great idea ￼￼ | 3w21 likesReply","1"
"DYgEBAIyQow","2026-05-23","imj.enna_","This is actually so cool! Instant download and follow","This is actually so cool! Instant download and follow | 3wReply","1"
"DYgEBAIyQow","2026-06-04","carlos_moren","Brochacho if it could read it for me would be legit! Like duo","Brochacho if it could read it for me would be legit! Like duo | 1wReply","1"
"DYgEBAIyQow","2026-05-22","ajcasutt","Bro I sent it to everyone","Bro I sent it to everyone | 3wReply","1"
"DYgEBAIyQow","2026-05-21","carriganlb_78","Do you have Persian? No one really does and I want the spirit in my studies","Do you have Persian? No one really does and I want the spirit in my studies | 3wReply","1"
"DYgEBAIyQow","2026-05-21","brin_bale","this is so genius fr","this is so genius fr | 3wReply","1"
"DYgEBAIyQow","2026-05-19","rjdavis_offical","Hey dude way to go. This is tough and you are doing the lords work","Hey dude way to go. This is tough and you are doing the lords work | 3w4 likesReply","1"
"DYgEBAIyQow","2026-05-29","thelifeof_camilaaa","Is it in the Spanish language as well ??","Is it in the Spanish language as well ?? | 2wReply","1"
"DYgEBAIyQow","2026-05-21","tess_198o","Android avalibility?","Android avalibility? | 3wReply","1"
"DYgEBAIyQow","2026-05-22","cmikos","Android please. I'll test","Android please. I'll test | 3wReply","1"
"DYgEBAIyQow","2026-05-19","sloosle","Nany More church members use android than iOS, please port to android.","Nany More church members use android than iOS, please port to android. | 3wReply","1"